study_id,title,year,metacognitive_capability,methods_benchmarks,models_tested,key_findings,theoretical_framework,limitations
S003,"Language Models Are Capable of Metacognitive Monitoring",2024,"Metacognitive monitoring of internal states","Neuroscience-inspired paradigm with confidence judgments; custom metacognitive tasks","GPT-3.5, GPT-4, Claude, LLaMA variants","LLMs can monitor limited neural activation subsets; metacognitive performance correlates with model size; models show above-chance metacognitive sensitivity","Signal detection theory; Type 1 vs Type 2 performance distinction","Limited to specific task domains; may not generalize to all metacognitive abilities"
S002,"Can LLMs Estimate Cognitive Complexity?",2024,"Cognitive complexity estimation","Novel benchmark measuring ability to predict problem difficulty","GPT-4, Claude, GPT-3.5","Gap exists between reasoning ability and metacognitive awareness; models produce correct answers but fail to identify reasoning complexity features","Cognitive load theory; metacognitive judgment framework","Focus on mathematical reasoning tasks only"
S007,"Metacognition and Uncertainty Communication",2024,"Uncertainty awareness and communication","Comprehensive evaluation across multiple uncertainty tasks","GPT-3, GPT-4, Claude, PaLM, LLaMA","Clear differences from human metacognition; LLMs show limited ability to communicate epistemic uncertainty; overconfidence in incorrect answers","Dual-process theory; metacognitive monitoring and control","Cross-sectional study; limited to prompted responses"
S004,"Language Models Coupled with Metacognition",2024,"Self-assessment and progressive refinement","SOFAI-LM framework combining fast LLM with slower reasoning model","Custom hybrid architecture with GPT variants","Metacognition-enhanced models outperform pure reasoning models; 15-20% improvement on complex tasks","System 1 and System 2 thinking; metacognitive control theory","Computational overhead; requires multiple model calls"
S006,"MetaFaith: Faithful Uncertainty Expression",2024,"Faithful uncertainty calibration","Prompt-based approach inspired by human metacognition","GPT-3.5, GPT-4, LLaMA-2, Mistral","Significant improvement in calibration (20-30% better ECE); models can express uncertainty more faithfully with metacognitive prompting","Metacognitive awareness theory; confidence calibration framework","Prompt-dependent; may not work for all domains"
S010,"ObjexMT: Metacognitive Calibration",2024,"Hidden objective recovery and calibration","New benchmark with calibration error metrics","GPT-4, Claude-3, Gemini","Models struggle with metacognitive calibration; average calibration error >0.3; poor at knowing what they don't know","Metacognitive monitoring; calibration theory","Limited to specific benchmark tasks"
S011,"Improving Metacognition via Fine-tuning",2024,"Uncertainty communication improvement","Supervised fine-tuning on metacognitive tasks","GPT-3 variants, T5","Fine-tuning improves metacognitive performance by 25-40%; transfer learning possible across metacognitive tasks","Learning to learn; metacognitive skill development","Requires labeled training data; may overfit"
S001,"MENTOR: Self-Evolution Framework",2024,"Value alignment self-assessment","Perspective-taking and consequential thinking strategies","GPT-4, Claude","Models can identify potential misalignments; self-reflection improves alignment by 30%","Theory of mind; metacognitive reflection","May rationalize rather than truly self-assess"
S012,"Evaluating Fake Reasoning Bias",2024,"Metacognitive confidence under deception","Fake chain-of-thought experiments","GPT-3.5, GPT-4, Claude","Simple cues hijack metacognitive confidence; models absorb fake reasoning as internal thought; 40% drop in metacognitive accuracy","Metacognitive illusion; cognitive bias theory","Focus on adversarial cases"
S005,"Metacognitive Reuse",2024,"Pattern recognition and behavior extraction","Analysis of reasoning traces for recurring patterns","GPT-4 with custom framework","Successfully converts 60% of recurring patterns into reusable behaviors; improves efficiency 3x","Metacognitive learning; procedural memory","Limited to specific reasoning patterns"
S013,"Self-Segregate Prompting",2024,"Knowledge conflict awareness","Self-Segregate prompting technique","GPT-3.5, GPT-4","Enables identification of knowledge conflicts before reasoning; 25% reduction in hallucination","Epistemic vigilance; metacognitive monitoring","Requires explicit prompting"
S009,"MASC: Metacognitive Self-Correction",2024,"Real-time error detection and correction","Unsupervised step-level monitoring","Multi-agent GPT-4 system","Achieves 85% error detection rate; 70% successful self-correction","Error monitoring theory; metacognitive control","Computationally expensive for real-time use"
S018,"Cognitive Workspace",2024,"Metacognitive memory management","Active memory planning and retrieval","Custom architecture with GPT-4","Outperforms RAG by 30% on complex tasks; shows human-like forgetting curves","Working memory theory; metacognitive strategies","Complex implementation"
S021,"Long-Term Memory Evaluation",2024,"Self-knowledge of memory limits","Long-context QA with confidence ratings","GPT-4, Claude with extended context","Models can recognize knowledge limits with 65% accuracy; better with explicit memory boundaries","Episodic memory; metacognitive knowledge","Limited to factual recall tasks"
S024,"SAGE-nano: Inverse Reasoning",2024,"Decision point identification","Attention-based reflection mechanism","Custom transformer architecture","Successfully identifies 75% of critical decision points; generates accurate reasoning explanations","Metacognitive monitoring; attention theory","Architecture-specific approach"
S014,"MetaMind: Social Reasoning",2024,"Theory of mind and social metacognition","Multi-agent framework with psychological tasks","GPT-4 agents","Shows emergent theory of mind; 60% match with human social reasoning patterns","Social metacognition; theory of mind","Limited ecological validity"
S016,"Cog-Rethinker",2024,"Hierarchical problem decomposition","Two-stage metacognitive framework","GPT-4 with RL fine-tuning","40% improvement on complex multi-step problems; effective subproblem identification","Hierarchical cognition; metacognitive planning","Training instability with RL"
S017,"Chain of Methodologies",2024,"Method selection awareness","Test-time computation scaling","GPT-4, Claude","Automatic method selection improves performance 20-30%; no fine-tuning needed","Metacognitive strategy selection","Limited to predefined method pool"
S019,"Path Drift Defense",2024,"Reasoning path monitoring","Role attribution and reflection cues","LLaMA-based reasoning models","Reduces reasoning drift by 50%; improves safety metrics","Metacognitive monitoring; error correction","May slow down inference"
S020,"Distillation Effects",2024,"Metacognitive transfer via distillation","Analysis of distilled model properties","Teacher: GPT-4, Students: smaller models","Distilled models show enhanced metacognitive markers; use more logical connectors","Knowledge distillation; metacognitive transfer","Unclear causal mechanism"
S023,"Comprehension Without Competence",2024,"Theoretical metacognitive requirements","Theoretical analysis and thought experiments","N/A - Theoretical paper","Identifies three key missing components: metacognitive control, principle lifting, grounded execution","Philosophical framework of understanding","Theoretical rather than empirical"
S025,"Pangu Embedded",2024,"Complexity-aware mode selection","Dual-system with automatic switching","Custom Pangu architecture","Achieves optimal compute-performance tradeoff; 2x efficiency gain","Dual-process theory; metacognitive resource allocation","Proprietary architecture"
S022,"Medical Domain Analysis",2024,"Domain-specific metacognitive reliability","Medical QA with uncertainty quantification","BioBERT, MedPaLM, GPT-4","Poor metacognitive reliability in medical domain; calibration error >0.4; high stakes = poor metacognition","Medical decision-making; uncertainty in diagnosis","Domain-specific evaluation only"
S015,"Think Reflect Create",2024,"Creative problem-solving metacognition","Three-stage framework: decompose, reflect, synthesize","GPT-4 with robotic applications","60% success rate on novel problems; reflection phase crucial for performance","Creative cognition; metacognitive regulation","Limited to structured problem domains"
S008,"MeLA Architecture",2024,"Performance feedback analysis","Iterative refinement with metacognitive evaluation","GPT-3.5, GPT-4","Systematic improvement over 5 iterations; 35% performance gain through metacognitive refinement","Feedback loop theory; metacognitive adaptation","Requires multiple iterations"